course_id,course_name,category,teacher,description
C_696796,互换性与测量技术基础,未标注,MOOCCubeX,“互换性与测量技术基础”课程是高等工科院校机械类、仪器仪表类及近机类专业中一门非常重要的专业技术基础课，用以培养学生机械产品精度设计能力，是机械设计中不可缺少的重要组成部分。
C_696798,AI技能初体验-图像识别（百度云智学院）,未标注,MOOCCubeX,本课程通过介绍图像识别三个领域，向学员展示图像识别技术的应用，然后就三个领域分别介绍各自领域不同的任务及应用，最后介绍百度图像技术的调用和应用场景，让学员学习人脸识别、文字识别、图像识别的技术实现与应用场景。
C_696801,AI技能初体验-智能语音技术（百度云智学院）,未标注,MOOCCubeX,本课程通过介绍语音处理的基本流程，引入语音处理流程中语音识别、语音合成、语音唤醒等阶段，并在之后的章节详细展开说明各个技术的作用。然后介绍百度语音技术的调用与应用场景，让学员了解语音处理的整体技术框架，掌握百度语音处理技术的调用以及适用场景。
C_696803,AI技能初体验-自然语言处理（百度云智学院）,未标注,MOOCCubeX,本课程介绍真实语言环境中出现的语义理解错误，引入自然语言处理基础技术，然后介绍语言处理基础技术在实际中的案例应用，最后分章节介绍百度自然语言处理技术的特色、调用方法、应答解析以及应用场景。
C_696812,股权融资相关法律知识,未标注,MOOCCubeX,掌握股权融资的概念、类型以及适格主体，了解股权融资中的基本法律问题、股权融资合同需要重点关注的条款。另外还可以学习到股权融资的新形式—众筹，和股权融资新的投资主体—有限合伙投资基金。
C_696814,普通化学,未标注,MOOCCubeX,《普通化学》课程是 环境工程、勘查技术工程、宝石与材料工艺学、资源勘查工程、给排水科学与工程、水文与水资源工程、金属材料工程、无机非金属材料工程、土木工程等专业的专业基础课。《普通化学》课程教学及建设任务由化学专业教师承担。
C_696817,工程热力学（下）,动力工程及工程热物理,MOOCCubeX,        这是一门研究热能与机械能相互转换以及热能有效利用充满生机的经典学科。无论你是初次接触还是为了温故知新，相信你都将获益匪浅。
C_696821,STEM课程设计与案例分析,教育学,MOOCCubeX,本课程是国内第一门结合STEM教育理论与课程设计的系统化MOOC课程，帮助STEM职前与在职教师、STEM教育工作者提升其专业素养。主要介绍了STEM教学理论知识、STEM教学教法、国内外STEM案例分析以及STEM的相关资源等，而且邀请来自加拿大、芬兰的教授进行 STEM经验分享，国际视野广阔。
C_696829,数学实验,未标注,MOOCCubeX,本课程是利用MATLAB软件学习、应用数学知识，目的是提高学生学习数学的积极性和对数学的应用意识，并培养学生用所学的数学知识和计算机技术去认识问题和解决实际问题的能力。
C_696827,概率论与数理统计,数学,MOOCCubeX,这个世界充满了许多不确定性，该课程将引导你学习定量描述随机现象统计规律的数学模型和计算方法。
C_696832,结构力学（1）,未标注,MOOCCubeX,人们生活、工作、学习在各种建筑中，也离不开堤坝、电塔、桥梁等建筑物和构筑物。为了安全，在设计和建造它们时要作受力分析，结构力学就是讲授结构受力分析方法的课程。
C_696837,传热学,未标注,MOOCCubeX,能源动力类的毕业生在工作后其主要职责之一就是提高能源的利用效率，为了达到这一目的，了解热能的传递机理、掌握热量的传递规律以及传热量的计算方法、进而确定强化或削弱传热的措施是十分必要的。学生通过本课程的学习，能够掌握上述工作所需的知识，使其更好地完成工作任务。
C_696840,军事理论,未标注,MOOCCubeX,本课程是本、专科学生的公共必修课，教学内容涵盖中国国防、军事思想、战略环境、军事高技术和信息化战争五大模块。
C_696846,形势与政策,未标注,MOOCCubeX,"形势与政策课是高校思想政治理论课的重要组成部分，是对学生进行形势与政策教育的主渠道、主阵地，是每个学生的必修课程。在大学生思想政治教育中担负着重要使命，具有不可代替的重要作用，是学生德育的一项重要内容。本门课程的主要目的是帮助学生正确认识国家的政治,经济形势,以及国家改革与发展所处的国际环境,时代背景,正确理解党的基本路线,重大方针和政策,正确分析社会关注的热点问题,激发学生的爱国主义热情,增强其民族自信心和社会责任感,把握未来,勤奋学习,成才报国。"
C_696845,机械原理,机械工程,MOOCCubeX,四川大学“机械原理”课程是四川省精品课程，是机械类各专业必修的基础核心课程。本课程可以为希望从事机械产品的创新、开发、设计和服务工作的人员，提供必不可少的专业知识，包括机构结构分析基本知识、机构的运动分析方法、机器动力学基本知识及常用机构分析与设计。
C_696854,数据库系统（中）：建模与设计,未标注,MOOCCubeX,数据库设计的正确性对大型软件系统开发是至关重要的，数据建模是计算机学科和软件工程学科必备的一种能力，学好本课程对于减少软件开发的失误有很大帮助。
C_696855,计算机文化基础,未标注,MOOCCubeX,面对无处不在的信息技术，你一定希望应用工具和技术解决常见的学习工作问题。甚至希望能够将信息技术应用到新的地方，那么，请加入课程学习！
C_696860,水分析化学,未标注,MOOCCubeX,学好水分析化学（水质分析技术），成为水质“眼睛”和“哨兵”，为水生态安全保驾护航。
C_696863,基层公共卫生服务技术,未标注,MOOCCubeX,课程以学生能开展基本公共卫生服务所必须的知识与技能为学习目标，以国家颁布的基本公共卫生服务项目为基础设置了相应的学习任务。
C_696867,天线原理,未标注,MOOCCubeX,本课程是电子信息类本科专业的必修课程，内容包括：天线的基本概念和基本理论；常用线天线及其阵列的基本工作原理；天线主要电参数的测量原理和方法等。学习本课程掌握常用天线的基本概念、基本工作原理和基本分析及测量方法。
C_696870,科学计算与数学建模,未标注,MOOCCubeX,本课程以数学建模思想、方法为主线，融科学计算方法、现代数学知识、计算机技术与实际问题求解为一体，训练运用数学工具建立数学模型、应用科学计算方法解决实际问题的技能技巧，培养学生的数学素质。
C_696875,创业管理,未标注,MOOCCubeX,"
在市场需求多样化、全球化的时代；在互联网和人工智能技术应用背景下；在社会经济政治变革的今天；各类组织必须具有创新创业精神；必须要有系统的创业知识和方法；必须培养一批有创新创业能力的创业者。"
C_696872,微电子工艺,未标注,MOOCCubeX,微电子工艺是一门介绍半导体集成电路制造技术的课程，重点阐述芯片制造基本单项工艺的原理、方法和应用。介绍金属互连、典型工艺集成、关键工艺设备，以及微电子工艺未来发展趋势。是电子信息类专业的核心课程。
C_696877,介质辐射传热,物理学,MOOCCubeX,热辐射司空见惯，在高温条件下更显著。发生在燃烧等非真空环境中的、介质强参与的热辐射传递过程，充满挑战。学习本门课程，你将经历一段充满智慧的旅程。
C_696882,钢琴弹奏基础,未标注,MOOCCubeX,欢迎加入《钢琴弹奏基础》 课程从认识键盘和五线谱讲起，从坐姿、手型和触键起步， 无论有无基础，都可学习！每个知识点既有理论讲授也有直观的弹奏示范和弹奏要点讲解。不仅满足广大零基础钢琴爱好者，也适用于有基础正在学习的钢琴学生进一步梳理和解决钢琴学习中的常见问题，快速提高弹奏能力。
C_696884,财务管理,未标注,MOOCCubeX,财务管理的根本目标是股东财富或是公司价值的最大化。公司财务管理的决策效率直接关系到股东的利益。掌握财务管理的基本理论和方法不仅对于企业高管的正确决策至关重要，对于投资者正确理解一个公司的行为和价值同样至关重要。
C_696886,小波与科学,未标注,MOOCCubeX,小波是最近三十年才迅速发展并日趋完善的崭新科学思想和研究方法，适合哲学、自然科学、工程科学、信息科学、视觉科学、生命科学和医学、经济学和管理学等学科领域学生和研究人员学习参考。
C_696892,中国传统艺术——篆刻、书法、水墨画体验与欣赏,未标注,MOOCCubeX,篆刻、书法和水墨画艺术是中国传统艺术的一部分，这三门艺术既独立存在，又结合紧密。篆刻是篆书与雕刻艺术的结合；书法是语言与文字的结合，是中国绘画的基础；水墨画是水与墨，形与意，诗、书、篆的合体。通过课程的学习，初步掌握三门艺术的基本理论与水墨画绘制方法，能够为后续的深入学习奠定良好的基础。
C_696897,理论力学,力学,MOOCCubeX,力学是研究物质机械运动规律的科学。理论力学研究作用在物体上的力与运动之间的关系。课程介绍理论力学的基本概念、基本理论和处理力学问题的基本方法。
C_696899,Office办公软件应用,未标注,MOOCCubeX,Microsoft Office是微软公司开发的一套应用较为广泛的办公软件套装，是日常工作和生活中信息处理的重要工具。本课程主要介绍Microsoft Office中的文字处理软件Word、电子表格处理软件Excel、演示文稿处理软件PowerPoint三个常用组件的基本操作方法。
C_696903,电动力学（下）,物理学,MOOCCubeX,物理本科阶段最难的课！自然界已知四种基本相互作用中与你生活最密切相关且紧密联系科学前沿的电磁作用的经典理论。各种进一步物理理论和应用的基础。
C_696901,西班牙语初级,未标注,MOOCCubeX,从零开始，发音会话一次学会，用最高效的课程，学最热情的语言，只需64学时，轻松说好世界第二大通用语——西班牙语。
C_696905,管理学,未标注,MOOCCubeX,管理学是经济和管理类专业的专业基础课，是一门系统地研究管理活动的普遍规律和一般方法的科学。学生通过这门课程了解管理的基本理论和基本原理，掌握管理学的学科体系，初步具有解决一般管理问题的基本素质和能力。
C_696907,大学生安全之消防大讲堂,未标注,MOOCCubeX,提升工作消防安全意识，预防火灾事故发生。
C_696908,走进心理学,未标注,MOOCCubeX,如何解读达芬奇密码？一个人梦游他自己知道么？先有语言还是先有思想？怎样能够拥有超凡的单词量？本门课将用最新最酷的心理学理论来解答这些问题。
C_696912,《论语》人生课堂,未标注,MOOCCubeX,在中国文化史上，孔子有着千古不灭的光辉一页：他首创私人讲学之风，编修六经，传承古代文明，创立儒家学派……一部记录孔子言行的《论语》，也被神化为可以“家天下”的经典。本课程试图跨越《论语》的篇章限制，突破语录体散文逻辑性匮乏的缺陷，还原一个真实而又丰富的孔子。
C_696917,大学计算机基础,未标注,MOOCCubeX,“大学计算机基础”分为两大部分，一部分是计算机理论教学，另一部分是计算机的应用能力的培养。
C_696915,高频电子线路,未标注,MOOCCubeX,高频难源于枯燥无味，课程易来自教学合一。欢迎您走进本慕课，领略高频之精华、之妙用。
C_696919,电路与电工实验,未标注,MOOCCubeX,讨论R、L、C等线性元件电路的电压、电流输入输出关系及负载功率，结合实验与仿真对电路分析方法加以应用，培养理工科学生必备的基础电路分析技能。
C_696918,暖通空调,大气科学,MOOCCubeX,掌握采暖、通风、空调设备与系统的基本概念和原理，了解各种有关设备和系统的特点和应用性能，培养运用基础理论与专业知识分析解决本专业问题的能力。
C_696920,管理学原理,未标注,MOOCCubeX,我们通过理论功底扎实的大学教师的系统理论讲授，以及实战经验丰富的企业老总的案例分析和经验分享，带领您领略管理的思想与理论，探讨管理的思维与逻辑，总结管理实践中的经验与教训，分享管理的心得与感悟。
C_696922,大数据机器学习,计算机科学与技术,MOOCCubeX,《大数据机器学习》课程是面向信息学科的高年级本科生或研究生开设的基础理论课，目的是培养学生深入理解大数据机器学习理论基础，牢固掌握大数据机器学习方法，并能够解决实际问题等综合能力。课程的主要内容包括：统计学习基本理论，机器学习基本方法，深度学习理论和方法。
C_696925,工程制图,机械工程,MOOCCubeX,不能口述，也不能用文字来描述一种事物，那能用什么呢？图形！工程制图就是教给你一种特殊的图形语言——用图纸去描绘我们的设计东西 ，人人都能看懂它，并以此去制造 、维修和检验。
C_696926,环境感知算法工程师基础课,未标注,MOOCCubeX,环境感知算法工程师基础课
C_696928,设计伦理,未标注,MOOCCubeX,"清华大学美术学院研究生必修课
清华大学研究生教改课程
院级研究生精品课
"
C_696931,环境生态学,未标注,MOOCCubeX,"环境生态学是生态科学与环境科学的交叉学科, 是一门新兴的边缘学科。运用生态学理论，研究人为干扰下，生态系统内在的变化机制，规律和对人类的反效应，寻求受损生态系统恢复，重建和保护对策的科学。这门课程注重生态学基本原理与实际应用的结合，介绍了生态学的基本理论，重点介绍生态系统生态学；阐述了生态系统服务、人为干扰对生态系统的损伤、生态恢复、生态系统管理及生态文明建设等。"
C_696935,信号与线性系统,未标注,MOOCCubeX,"信号与线性系统研究信号与系统理论的基本概念和基本分析方法,建立信号与系统的数学模型，经适当的数学分析求解，对所得结果给以物理解释、赋予物理意义。本课程的核心任务是要构建一座从数学到物理和工程技术的桥梁，引导学生从理论学习过渡到专业工程训练。"
C_696936,环境感知算法工程师专业课,未标注,MOOCCubeX,环境感知算法工程师专业课
C_696942,日语与日本文化,未标注,MOOCCubeX,你想了解日本人的生活细节和民族文化吗？你想快速掌握日语的基础知识吗？欢迎选择本课程。
C_696947,语言学概论,未标注,MOOCCubeX,语言是斑斓的万花筒，我们对语言的诠释林林种种，色彩纷呈。语言是优美的旋律，我们的声调和语调抑扬顿挫，美妙悦耳。语言是鲜活的词汇，千般姿态、万种风情，层出不穷。语言是规则的体系，我们的语言表达规范、彼此理解。语言是意义的集合，纷繁复杂，变幻莫测，表情达意。语言是交际的工具，我们使用语言相互沟通，幽默诙谐。本课程主要包括了微观语言学的主要分支和现代语言学的主要理论。我们将要讨论微观语言学的六大分支：语音学、音位学、形态学、句法学、语义学和语用学。同时我们会探讨一些现代语言学的观点和理论，比如索绪尔的结构主义、布拉格学派、伦敦学派、美国结构主义和转换生成语法。
C_696954,商学导论：10节课带你走进商业世界,未标注,MOOCCubeX,作为管理学入门课，从行业、企业及个人层面，引导学生观察、理解商业世界的基本逻辑，对企业管理有更深入的了解。 
C_696955,职场菜鸟礼仪指南,未标注,MOOCCubeX,"细节决定成败，优秀是一种习惯！
中华民族素有“礼仪之邦”的美誉，礼仪文化源远流长。礼仪能有效地展现施礼者和还礼者的教养、风度与魅力，体现着个人对他人和社会的认知水平、尊敬程度。礼仪是人际交往活动中不可缺少的润滑剂，是通往职场必备的一项职业技能。"
C_696956,中国茶道,未标注,MOOCCubeX,茶道，既是形而上之道，无形无象，天人合一；又是形而下之器，有形有象，解渴驱乏，更是一种渗透于生活的文化、哲学、艺术、价值观和美的生活方式。
C_696965,啤酒酿造与文化,食品科学与工程,MOOCCubeX,为什么从古代最庄重的祭祀到如今最放纵的狂欢，都离不开酒？为什么胜利的歌曲唱响美酒飘香的同时，冷峻的哲学也在论证醉人琼浆？作为当今与百姓生活最密切的啤酒又有着怎样的前世今生？成为“啤酒达人”又需要掌握哪些“门道”？通过学习聂聪老师的《啤酒酿造与文化》课的学习，让我们一起进入缤纷的啤酒世界。
C_696973,互联网金融,未标注,MOOCCubeX,互联网金融是一个新兴的行业，已经在许多方面改变了人们的生活，也将对未来的经济发展产生重要的影响。
C_696976,管理学,未标注,MOOCCubeX,本课程通俗易懂、视角别具一格，适合管理学零基础的学生学习，着重从现实工作与生活的角度出发，能够使学生系统地掌握管理活动的普遍规律，树立现代管理的思想观念，培养管理者的素质，为其他管理学专业课程的学习和成为一名“懂得管理的人”打好基础。
C_696980,日语初级,未标注,MOOCCubeX,本课程面向全校非日语专业零起点学生，教学目的在于激发学生对日语学习的兴趣，培养正确的学习方法和良好的学习习惯。在教学过程中，引导学生科学掌握日语基础知识，同时循序渐进，培养学生的自学能力。
C_696991,数字营销：走进智慧的品牌,未标注,MOOCCubeX,物联网、云计算、大数据、虚拟现实、人工智能，一场数字营销技术的完美风暴正拉开序幕，一个全新的品牌时代即将来临。
C_696992,文化差异与跨文化交际,未标注,MOOCCubeX,《文化差异与跨文化交际》将带您一起跨越历史的长河，追溯文明的起源，领略中西方文化的魅力，了解沟通技巧与国际礼仪，帮助您克服文化冲突和跨文化交际障碍，为您开启一扇通向世界的大门——国际视野、国际人才。
C_696993,生活中的货币时间价值,未标注,MOOCCubeX,货币是什么？历经了哪些形态？为什么一鸟在手胜于两鸟在林？复利的威力到底有多大？多重现金流是什么？贷款陷阱该如何规避？证券定价知多少？应该投资哪个项目？如何未雨绸缪，让自己老有所依？本课程将会告诉您答案。
C_696998,排球,未标注,MOOCCubeX,排球课程面向初学者及致力于排球教学的爱好者。内容涵盖排球运动基本理论，基本技术、战术，教学及练习方法，规则与裁判等。通过学习您将更好地理解“女排精神”，分享排球运动的魅力。让我们一起打排球吧！
C_696999,英语国家概况——纵览·博闻,未标注,MOOCCubeX,带你了解英语国家，讲述关于他们的传说和真实，呈现予你他们的过去和现在。
C_697001,广告学精要,未标注,MOOCCubeX,《广告学精要》是广告常识和广告素养研习的慕课课程，也是相关行业人士和广告学子互动交流和专业学习的拓展性课程；通过主讲教学视频以及大家交流反馈信息，不断更新补充有关理论及知识教条，解读广告业和广告学所面对的新挑战和新机遇，分享当下广告学界与业界的前沿思想和观点交锋。
C_697003,企业战略管理,未标注,MOOCCubeX,通过“线上+线下”互动，释放学员大量线下课堂时间，提高学习效率，更好地掌握战略管理的基本理论和方法工具，形成观察、思考、分析和解决战略问题的能力，培养全局观念与战略洞察力，养成战略性思维习惯。
C_697005,视觉语言,艺术学,MOOCCubeX,艺术在不同的时代意义不同。课程试图分解构成视觉艺术的元素、因素、人文背景和工具材料，了解艺术的成因，学习传统，得出个人有创造性的艺术定义。
C_697008,程序设计基础（下）,未标注,MOOCCubeX,“程序设计基础“是一门面向计算机相关专业以及新工科各专业学生开设的专业基础课程，也是理工科各专业的公共必修课程。本课程包括：程序设计基础（上）和程序设计基础（下）两部分。
C_697011,运动心理学,未标注,MOOCCubeX,本课程系统讨论竞技运动中的心理学问题，从运动心理学的发展脉络，运动员的动力来源、心理特征、认知过程、自我完善、心理健康和社会互动等领域介绍相关研究的发展脉络、研究特点和重要成果。
C_697018,数字电子技术基础,电子科学与技术,MOOCCubeX,电子技术的应用“无所不在”。不管哪个领域、哪个行业，为实现现代化、自动化、信息化，就必须配以电子系统。“电子技术基础”课程教授实现电子系统必备的基础知识。
C_697019,移动快速应用开发,未标注,MOOCCubeX,App Inventor是一门无需代码编写，通过积木式搭建的安卓开发工具。通过它，可以把你的创意快速实现，把你的想法变成现实。来吧，让我们一起感受编程的乐趣！
C_697020,西方美术史十六讲,未标注,MOOCCubeX,"以时间为轴，领略欧洲美术的历史发展状貌；
以图像为镜，体察造型艺术中蕴含的深刻人文内涵；
以课程为茶，品味美术世界里的因缘际会与文化百态。"
C_697023,纺织导论,未标注,MOOCCubeX,本课程是面向纺织类专业开设的一门专业基础课。目标是帮助学生掌握纺织科技的核心知识，为专业核心课程的学习奠定良好的基础。
C_697027,电路分析基础,未标注,MOOCCubeX,本课程主要研究电路的基本概念、基本规律和分析计算方法，是后续专业课的桥梁，理论严密、逻辑性强、有广阔的工程应用背景，可培养抽象思维能力，提高分析解决问题的能力。
C_697030,Foundations of Computer Graphics,未标注,MOOCCubeX,CS184.1x教授计算机图形学基础。学生通过本课程将学会制作实时和离线光线追踪3D场景的图像。
C_697031,线性代数（简明版）,未标注,MOOCCubeX,        线性代数（简明版）以同济大学《线性代数》教材内容为课程主讲内容，主要针对线性代数的一些基本概念，基本理论和基本方法进行简明概要地讲授，并且配有简明应用案例及Matlab求解线性代数的简明问题，每讲时长大约5~10分钟。线上模块包括：视频课件，课程讲义，配套习题，答疑讨论区等。
C_697036,植物组织培养技术,作物学,MOOCCubeX, 植物组织培养技术是植物生物技术的重要组成部分。目前，该技术在植物组培快繁、植物脱毒、植物育种、生物制药等各个领域已得到广泛的应用，并取得了显著的经济效益。发展组培产业不仅能提高农业效益，增加农民收入，同时也能为生物基础研究、医药、食品等领域作出贡献。植物组培是一种手段，也是一门技术，更是一门艺术。
C_697034,唐宋词鉴赏,未标注,MOOCCubeX,介绍词的起源，系统讲授唐宋词的代表作家、代表作品和重要流派，以讲作品为主，兼及历史、民俗及人文精神。
C_697041,英语语言学,未标注,MOOCCubeX,"英语语言学这门课程为学生讲解语言学的基本概念和理论，使学生对语言的本质和交际功能有深入的了解。其涵盖的内容是语言学的核心分支：语音学、音系学、形态学、句法学、语义学和语用学。通过学习，学生能掌握语言分析的术语和方法，由此运用到对各种语言的描述和分析。
《英语语言学》慕课课程，期待与你相拥！"
C_697046,人工智能,未标注,MOOCCubeX,本课程系统的介绍了人工智能的基本原理、方法和应用技术，对国内外人工智能领域的最新研究成果也进行了讨论。
C_697045,女生穿搭技巧,未标注,MOOCCubeX,课程运用模具、服装、图文并茂，通俗易懂。依据女生不同的身材、肤色、个性等方面讲授服装搭配的方法和技巧，提高服饰审美和穿着搭配能力。课程受众面广，实用性强，不仅让女生变得穿着得体、端庄雅致、青春靓丽，甚至改变了她们的生活态度，让她们更加沉稳自信。本课程为江西省精品在线开放课程、国家精品在线开放课程。
C_697048,土力学,地质学,MOOCCubeX,土力学是一门很土的力学，也是一门艺术，它教你如何高明地解决与土的强度、变形和渗透有关的各种工程问题。
