course_id,course_name,category,teacher,description
C_1844118,Acupuncture and Moxibustion,未标注,MOOCCubeX,"         Acupuncture and moxibustion, as the important part of Traditional Chinese medicine(TCM),  has been accepted by the general public as safe and efficacious therapies.          By learning this online course, you will master the locations and functions of important acupoints, the manipulations of needling, moxibustion and cupping，and the management of some commonly seen symptoms in daily life. More importantly, your body will be healthier if you apply acupoint pressure from time to time."
C_1844126,Molecules that Changed the World,未标注,MOOCCubeX,"Popularize science at first，while taking fun into account；expand knowledge，explore science. In the course, we will introduce the way that scientists how to find those molecules, such as morphine, aspirin, taxol, insulin, that changed the world. And we will also introduce the chemical constitution, mechanism and effect of those molecules. "
C_1854857,工业样板设计,未标注,MOOCCubeX,"""本课程设置8个实验：男西裤工业样板设计与推板、男衬衣工业样板设计与推板、职业女西装及变化款工业样板设计与推板、男平驳领、戗驳领西装工业样板设计与推板、女风衣样板设计与推板、女插肩袖大衣样板设计与推板。工业样板设计课程采用理论与实践相结合的教学方法，老师通过讲解原理、示范操作、实践指导等方式进行教学，并采用板书、多媒体课件及CAD操作演示等教学手段辅助教学，为了强化能力培养，每个章节都设置了思考与练习，其中思考题主要是强化理论知识的掌握，练习题都是在典型款式的基础上的延伸，配套性的设置了8个实验，目的是让学习者举一反三、活学活用，达到强化能力培养的目的。"
C_1854868,服装结构设计,未标注,MOOCCubeX,    本课程阐述了服装结构设计的基本过程、概念、方法，分析了服装人体结构与人体骨骼、肌肉等之间的关系，介绍了服装国家标准术语、符号、代号及国际服装规格标准与表达方法，重点讲解服装结构设计中上衣装、下身装和领子、袖子的结构设计原理，并利用原型对省道等结构变化规律分别加以解说。
C_676913,习近平新时代中国特色社会主义思想,军队政治工作学,MOOCCubeX,国家治理认证证书项目拟定由《习近平新时代中国特色社会主义思想》、《公共危机管理》、《当代中国发展和改革》、《公共政策分析》、《大数据治理与政策》、《绿色创新理论与实践》六门课程组成，后续可根据项目实际情况进行调整。课程均由清华大学公共管理学院一线教师授课，为学习者们系统化地介绍现代国家治理的理论、知识与技能。通过学习，学习者可以掌握国家治理的新理论、新方法，具备在实际工作中运用相关理论和方法解决实际国家治理问题的能力与技巧，培养社会企业家精神。
C_735046,绿色创新理论与实践,未标注,MOOCCubeX,国家治理认证证书项目拟定由《习近平新时代中国特色社会主义思想》、《公共危机管理》、《当代中国发展和改革》、《公共政策分析》、《大数据治理与政策》、《绿色创新理论与实践》六门课程组成，后续可根据项目实际情况进行调整。课程均由清华大学公共管理学院一线教师授课，为学习者们系统化地介绍现代国家治理的理论、知识与技能。通过学习，学习者可以掌握国家治理的新理论、新方法，具备在实际工作中运用相关理论和方法解决实际国家治理问题的能力与技巧，培养社会企业家精神。
C_1829954,当代中国发展与改革,未标注,MOOCCubeX,国家治理认证证书项目拟定由《习近平新时代中国特色社会主义思想》、《公共危机管理》、《当代中国发展和改革》、《公共政策分析》、《大数据治理与政策》、《绿色创新理论与实践》六门课程组成，后续可根据项目实际情况进行调整。课程均由清华大学公共管理学院一线教师授课，为学习者们系统化地介绍现代国家治理的理论、知识与技能。通过学习，学习者可以掌握国家治理的新理论、新方法，具备在实际工作中运用相关理论和方法解决实际国家治理问题的能力与技巧，培养社会企业家精神。
C_948409,大数据治理与政策,未标注,MOOCCubeX,国家治理认证证书项目拟定由《习近平新时代中国特色社会主义思想》、《公共危机管理》、《当代中国发展和改革》、《公共政策分析》、《大数据治理与政策》、《绿色创新理论与实践》六门课程组成，后续可根据项目实际情况进行调整。课程均由清华大学公共管理学院一线教师授课，为学习者们系统化地介绍现代国家治理的理论、知识与技能。通过学习，学习者可以掌握国家治理的新理论、新方法，具备在实际工作中运用相关理论和方法解决实际国家治理问题的能力与技巧，培养社会企业家精神。
C_1862240,公共政策分析,未标注,MOOCCubeX,本课程为蓝志勇教授多年来从事公共管理与公共政策的教学和研究的思想和体会，是根据特定的MPA学生群体做出的课程设置。
C_1864055,Teach Me Trade Simulation,未标注,MOOCCubeX,"Your business career will start here !  It is a course to practice export trade in the simulated business environment. What is the approach? Learning by doing simulation tasks in a Chinese trading company.  What will you gain from the course? Understanding of export procedures and operational skills. If you are interested in international trade practices in China, this course is a good choice for you. Wherever you are, you can learn it anytime on internet."
C_1864058,Contemporary Electronic System Design,未标注,MOOCCubeX,"This course systematically introduces contemporary electronic systems based on the system-on-chip (SoC) concept, including system composition, design methods, latest technologies, design examples, experiment contents and experiment results, etc. The focus is to help students systematically master the design methods of contemporary electronic systems, as well as cultivate innovative design ideas."
C_1864060,中外文化精神十讲,未标注,MOOCCubeX,    通过本课程的学习，学生可以充分了解中外文化精神的基本内容，对绵延至今的文化精神形成自己的独特体悟，在理解的基础上，运用到日常学习与生活中，既提升自我的人文素养，又能够以此为桥梁，贯通古今，与天地精神相往来，与古今中外哲人对话，从而塑造良好的人生观。
C_1864065,化工流体流动与传热,未标注,MOOCCubeX,       《化工流体流动与传热》（化工原理上册）用自然科学的原理（主要为动量、热量传递理论）考察、解释和处理化学工程中的实际问题，研究方法主要是理论解析和在理论指导下的实验研究。通过本课程的学习，应能够运用动量和热量传递的基本理论，解决流体流动、流体输送、沉降分离、过滤分离、液体搅拌、过程传热、蒸发等单元操作过程的计算及设备选型等问题，并为后续专业课程的学习奠定基础。
C_1864068,应用随机过程,未标注,MOOCCubeX,俗话说随机过程随机过，谁学谁知道它的难。而本课程你却会听到这样的内容，盗梦空间四层结构方式学习条件期望、傅里叶变换和特征函数的前世今生、经受住遍历性考验的才是最好的爱情、为什么说地面的蚂蚁总能回家而空中的鸟儿却不能，说说Google排序那些事，……。随机过程的思想和实例就在我们的身边，别怕那些晦涩的术语，别担心智力被无情地碾压，轻轻松松跟随着我们的课程开启随机思想之旅吧。
C_1875488,经典启蒙,未标注,MOOCCubeX,幼儿《经典启蒙》是中华文化的源头活水，是中华民族的智慧结晶，是开蒙养正的经典读物。富有童趣的语言易于幼儿诵读和记忆；极具理趣的内涵便于幼儿感受中国传统文化的熏陶；并培养其优秀的品格。融幼儿审美、娱乐、认知的艺术价值为幼儿的文学修养打下良好的基础。
C_1875490,班主任技能训练,未标注,MOOCCubeX,班主任是学生生命中遇到的有限的老师，是其成长历程中的“重要影响者”。怎么成为一名优秀的班主任呢？《班主任技能训练》将带领大家走近班主任工作，了解班主任工作的特点，掌握班级管理的基本技能，共同领略教育的美好和幸福。
C_1875498,近世代数,未标注,MOOCCubeX,"         你想知道如何破解魔方、滑动拼图等游戏的秘密吗？你想知道足球到底有多对称吗？你想了解支票防伪和网络数据安全传输背后的代数学知识吗？你想了解费马大定理的前世今生吗？你想了解古希腊三大作图难题是如何解答的吗？…… 
       请走进《近世代数》，这里你可以尽情地享受当代代数学盛宴，寻找到所有这些问题的完美解答。与此同时，你还可以认识高斯、伽罗华、阿贝尔等诸多数学奇才，重走他们在数学王国的探险之旅！相信通过学习“置换群”、“环的理想”、“超越元”等经典而优美的代数学知识，或许你可以置换人生、超越梦想，为实现自己的理想而展翅高飞！"
C_1875503,中国传统文化英译技巧,未标注,MOOCCubeX,"      想成为翻译高手吗？ 想知道翻译的奥秘吗？想得心应手地推介中华文化吗？跟着我们学起来吧！
     《中国传统文化英译技巧》旨在通过系统的讲解和训练培养学习者正确的翻译观以及合理选择翻译策略的能力，使学习者者能够熟练掌握并使用各种翻译方法和技巧，以确保和提升翻译水平。通过课程学习让学习者不但领悟到中华文化的博大精深，而且意识到传播中国文化的紧迫性，增强他们的责任感，以期为“讲好中国故事”、传播中国文化培养合格人才，为弘扬和推介中国文化尽一份力。 "
C_1875512,理工创新工坊,未标注,MOOCCubeX,《理工创新工坊》是在双创教育的大背景下建设而成的一门创新创业教育在线通识课，课程面向全体学生，不分文科、理科、工科，不限年级，不需要先修课程，以创新创业理论结合案例分析。希望大家都能在这门课中感受到创新的乐趣，从不同领域创新创业的故事中受到启发，将创新创业与自己的专业领域结合起来，共筑双创新时代。
C_1875515,概率论,未标注,MOOCCubeX,随机数学是研究随机现象统计规律性的一个数学分支，其基本理论与方法已经被广泛地应用于自然科学、社会科学、管理科学以及医学等众多领域。随机数学主要涉及到概率论、随机过程、数理统计、时间序列分析、随机运筹等课程。概率论作为随机数学的基础，是认识、刻画、分析各种随机现象的入门课，是数学与统计学专业本科生一门非常重要的理论基础课程。                                                                                                                                    概率论以具有不确定性的随机现象为研究对象，以探讨和研究随机现象的统计规律性为任务。课程内容主要包括随机事件与概率、随机变量及其分布、多维随机变量及其分布、随机变量的数字特征、大数定律和中心极限定理等。课程即强调知识的应用能力训练，也强调严密的数学逻辑思维，既在测度论的框架下初步介绍了概率论的知识体系，又建立了直观认知和理论分析的联系。                                                  
C_1883679,Understanding Risk and Sustainable Development,未标注,MOOCCubeX,"The COVID-19 pandemic indicates a new future of risks abiding in human society and our everyday life. In this course, students have access to cutting-edge knowledge of risk, risk governance and development as well as specific facts related to COVID-19 as one of the most recent and relevant key to understand global risk governance."
C_1884005,Supporting Health and Risk Governance in Communities,未标注,MOOCCubeX,"Community-based action are key in local safety and development. In this course, students would be able to acquire on-the-ground skills as well as to understand risk on community level by learning guiding principles and tools for Risk Communication and Community Engagement (RCCE) in terms of health and broader risk governance. "
C_1884058,Building Community Resilience and Development,未标注,MOOCCubeX,"Beyond crisis, we look to development. This course enables students to discuss community-level vulnerabilities and relevant intervention as well as local innovation in building community resilience that supports sustainable development. "
C_1886668,数值计算,未标注,MOOCCubeX,       想了解和学好科学计算技术吗？录制了当前网络视频热播课程《数值分析》的北京交通大学王兵团教授，经过十五年的教学科研历练，再次录制了这门《数值计算》课程视频。新录制的课程将给你一个学习《数值计算》课程的全新体验，让你轻松学习科学计算知识和技术、增强数学建模的能力！
C_1886672,宠物美容与护理,未标注,MOOCCubeX,《宠物美容与护理》是宠物养护与驯导专业的专业核心课程，本课程以岗位胜任能力为导向制定的学习内容，学习完本门课程后能够按照规范的操作流程完成宠物美容岗位工作任务，成为一名爱岗敬业、热爱生命、具有创业精神和创业能力的宠物美容师。宠物美容与护理课程为您开拓宠物美容师之路，助力您实现创业梦想！
C_1886674,工程材料及机械制造基础,未标注,MOOCCubeX,工程材料及机械制造基础课程，将为你揭开神秘的材料面纱，详解最先进的机械制造方法及原理。经教学团队多年精心打造，突破传统授课模式，创新性地采用多元化教学形式，幽默地解读科学中的真理，学习将变得轻松有趣。
C_1886678,Introduction To Hospitality,未标注,MOOCCubeX,"Did you ever wonder who will never be replaced in the world?  People working in the Hospitality industry!  Did you ever wonder which job allows you to build friendship all over the world?  Jobs in Hospitality!  Hospitality is a multi-billion-dollar industry and the fastest-growing business. It is full of vitality, innovation and challenges.   If you’re interested, please join us. This course is designed right for you to truly understand this industry and become part of it. It introduces the hospitality hist"
C_1886685,Heat Transfer,未标注,MOOCCubeX,"Heat transfer is a basic science that deals with the rate of transfer of thermal energy caused by temperature difference. From the HVAC of modern buildings to the formation of wind, frost, rain and snow in nature, from the thermal protection of space shuttle re-entering the atmosphere to the effective cooling of electronic devices, from the human wearing all the year round to the freezing and storage of human organs, all are closely related to the transfer of thermal energy. "
C_1886688,The Hardware/Software Systems and Fundamentals of Programming,未标注,MOOCCubeX,"Computer has become an indispensable part of human life. If you want to be an excellent programmer or computer control system designer, you need to clearly understand the internal mechanism of a computer. As an introductory course, this course will open the door to computers for you, to show you the mysterious organizations inside computers that you may not have seen and how they work. It will lay the foundation for you to further master the basic ideas and methods of using computers to solve problems."
C_1886689,Histology and Embryology,未标注,MOOCCubeX,"A unique way to observe the human body in microscopic perspective！ A delicate aspect to explore the structures and functions of tissues and organs！ Discovering great things from small, Illuminating the mystery of how life originate！ Think carefully, discern clearly, and seek constantly ！ Welcome to learn Histology and Embryology!"
C_1886691,The Economic Way of Thinking,未标注,MOOCCubeX,"Economics is a way to observe the real world. In this MOOC course, Prof. YU Weihua and his colleagues will guide students to look at the world from the economic perspective with vivid and humorous language and real economic stories. In ten or twenty years’ time, students may forget the specific knowledge they are given today, but they will retain the way of thinking they are trained in. "
C_1886696,Communication of Chinese Costume Art,未标注,MOOCCubeX,"This course will lead you to walk the long river of Chinese clothing and explore its source, flow direction, branch, convergence and spray. Choose this course, you will find the beauty of Chinese clothing, and then establish cultural self-confidence, improve aesthetic literacy. This is an aesthetic education promotion course, which can improve your artistic quality and humanistic spirit  This is a professional popularization course. You can get a new interpretation when exploring the essence of clothing"
C_1889028,清华数为应用开发平台DWF第三期培训,未标注,MOOCCubeX,清华数为应用开发平台DWF第三期培训
C_1889446,英语四级考前极速提分班,未标注,MOOCCubeX,四级考前押题预测串讲应试技巧
C_1890207,英语六级考前极速提分班,未标注,MOOCCubeX,六级考前押题预测串讲应试技巧
C_1891038,Pharmacology,未标注,MOOCCubeX,"According to the medical practitioner qualification examination syllabus，pharmacology MOOC mainly introduces 7 modules of pharmacology, including pharmacology overview, efferent  nervous system medicine pharmacology, central nervous system medicine pharmacology, cardiovascular system medicine pharmacology, visceral and blood system medicine pharmacology, endocrine and metabolic medicine pharmacology and chemotherapy.  "
C_1891042,Internal medicine - cardiovascular disease,未标注,MOOCCubeX,"     Cardiovascular system is one of the most important chapters in internal medicine. It is a compulsory course for all the medical students. This course is mainly aimed at medical undergraduates, which can be expanded according to their basic knowledge. Meanwhile, it can improve learning efficiency and teaching quality by combining clinical cases, video demonstration and other methods."
C_1891044,Oncology：Cancer Prevention&Treatment and Healthy Life,未标注,MOOCCubeX,"Cancers severely affect human health. With an increase of morbidity and the improved living standards, increasing attention has been attached to health problems. Therefore, it is necessary to pass on cancer-related knowledge to college students. By learning this course, students will be able to develop an awareness of the basic concepts of oncology, analyze and elaborate on the pathogenesis of cancers, and advocate scientific prevention and healthy life while working in the fight against cancers."
C_1891046,Accountant in Business,未标注,MOOCCubeX,"Learn what to expect on your ACCA journey! Just start with Accountant  in  Business （F1）. I will support you on that path. Let us work together!  YES,WE CAN!"
C_1891049,Dental Anatomy and Physiology,未标注,MOOCCubeX,"Dental Anatomy and Physiology mainly studies the normal morphological structures, functional activities and clinical applications of the oral cavity, skull, face and neck."
C_1891387,21考研英语强化班,未标注,MOOCCubeX,21考研英语强化班
C_1894844,21考研英语阅读基础精讲班,未标注,MOOCCubeX,21考研英语阅读基础精讲班
C_1894860,21考研英语小白课堂,未标注,MOOCCubeX,21考研英语小白课堂
C_1894884,21考研英语核心语法长难句突破班,未标注,MOOCCubeX,21考研英语核心语法长难句突破班
C_1894914,21考研英语词汇精讲班,未标注,MOOCCubeX,36节母词课带你记住考研核心词汇，掌握高效记词方法。
C_1894960,21考研英语冲刺班,未标注,MOOCCubeX,21考研英语冲刺班
C_1899192,21考研英语逆袭75分特训营,未标注,MOOCCubeX,21考研英语逆袭75分特训营
C_1903962,供热工程,未标注,MOOCCubeX,"供热为民暖，情暖千万家。寒冷的冬日，供热能够带给你一室暖春，给你一个温暖的怀抱。
我国严寒和寒冷地区，覆盖了19个省、直辖市、自治区的134个地级以上的大、中、小城市，还有非常多的县区，这些地方需要设置集中供热。在长江流域的夏热冬冷地区，冬季也需要采取供暖的措施。
截止到2018年，我国集中供热面积已近80亿平方米。且逐年持续稳定在增加。在冬季，室外冰天雪地，寒风凛冽，室内和煦如春，一片暖阳，这离不开先进的供热技术，离不开可敬的供热人！
作为用户你想了解供热的基本原理吗？你知道暖气如何进你家吗？如果你家的暖气不热，你知道怎么解决吗？作为供热技术人员我们该如何选择合适的供热设备，如何合理布置管路系统呢？我们怎样才能既提高供热效果，又降低供热能耗呢？在供暖期该如何通过供热调节，保证室温恒定呢？在非供暖期，供热人又做了哪些默默无闻的奉献呢？《供热工程》将为你答疑解惑。——课程团队"
C_1903965,应用老年学基础,未标注,MOOCCubeX,随着全球人口老龄化进程的不断进化， 为老年人服务和长期照护管理者的需求也不断增加。 为了解决对于为老年人服务和长期照护管理人才管理的需求，特别设置了此课程。“应用老年学”是“老年学”的一个分支学科。所谓应用，就是把老年学的理论和视角用于我们日常的社会实践。例如在医疗领域，老年学的应用帮助我们认识到现有卫生体系满足老年人需求的局限，我们需要做些改变；对卫生体系的改革推动了长期照护服务的发展；老年学还引导市场关注老年群体的消费行为；老年学的研究还为老年政策的制定提供着科学的依据。
C_1903973,医学心理干预,未标注,MOOCCubeX,你最近是否情绪低落？时常感到无助和无望；思维变得迟缓，记忆力衰退，感觉“脑子好象是生了锈的机器”？也许，你已经中了“抑郁”的招儿了。他用了8年的时间，针对抑郁症进行了精确的诊断和分类，帮助了数以千计的患者成功击败病魔，彻底走出了“抑郁”的阴影。
C_1903976,中华民族历史,未标注,MOOCCubeX,一部中华民族史，就是一部各民族不断团结凝聚、共同奋进的历史。贯穿古今，鉴得失、知兴替，树立和坚持正确的历史观、民族观、国家观，铸牢中华民族共同体意识。
C_1903980,抗美援朝精神,未标注,MOOCCubeX,本课程带你一起穿越到那一场硝烟弥漫、战火纷飞的抗美援朝战场，亲历一次保卫和平、反抗侵略的正义之战；带你一同学习习近平总书记关于抗美援朝精神的伟大论述，唱响一曲曲抗美援朝精神的英雄赞歌；带你一道走近那一个个英勇顽强、舍身忘死的志愿军战士，追寻那一位位最可爱的人……
C_1903982,《风从东方来：今日中国概况》（全英文）,未标注,MOOCCubeX,"《风从东方来：今日中国概况》课程基于经典中国文化的“底色”，聚焦当代中国的创新发展与全新面貌，旨在向国内外学习者展示一个活泼开放、奋发图强、兼容并包的中国形象，传递当代开放与传承的大国理念与情怀。 资助来源：本课程受杭州市哲社重点研究基地杭州师范大学外国文学与话语传播研究中心资助。
"
C_1903983,学前教育学,未标注,MOOCCubeX,本课程主要讲授对0-6岁学前儿童教育的基本规律与教育原则。通过本课程的学习，学习者可获得学前教育的正确观念，包括科学的儿童观和教育观，掌握学前教育的基本原理。
C_1903988,太阳能利用原理与技术,未标注,MOOCCubeX,《太阳能利用原理与技术》是新能源科学与工程专业的必修课。课程的目标是：（1）知识贡献：使学生获得必要的太阳能利用原理、技术、工程等方面的基本理论和基础知识。(2)能力贡献：培养学生分析和解决太阳能工程领域的实际问题的能力和系统思维能力。(3)素质贡献：培养学生具有全球视野及可持续发展理念。
C_1903992,艺术与经营相会,未标注,MOOCCubeX,随着当今融复合学科普遍化的潮流，将经营学引入到艺术领域的艺术经营也正在普及。
C_1904002,Management: Chinese Perspective and Practice,未标注,MOOCCubeX,"This course is designed to introduce the link between Chinese traditional culture and modern management. Viewing from the perspective of sinology and its practice, the principles and approaches of modern management has been illustrated. Taking the historical evolution of management as the clue, this course has summarized managerial thoughts and practical experiences that greatly benefit modern management."
C_1904032,2021考研政治学霸基础篇,未标注,MOOCCubeX,2021考研政治学霸基础篇
