course_id,course_name,category,teacher,description
C_916843,婴幼儿心理与行为指导,未标注,MOOCCubeX,本课程着重介绍出生至入小学前儿童心理的整个面貌，课程的目的在于使学生掌握从事学前教育工作所必需的心理学基本理论知识；了解婴幼儿的心理及行为表现，能运用心理学知识去分析和解决在教育婴幼儿过程中所遇到的实际问题。
C_916844,创业理论与实践,未标注,MOOCCubeX,创业理论与实践
C_916853,Survival Thai,未标注,MOOCCubeX,"本课程提供对泰语和泰国文化的基本理解，侧重听、说。
"
C_916858,中国概况 ,未标注,MOOCCubeX,"想要更好地了解中国吗？请加入我们，让我们一起去探索真实的中国概况。
Do you want to better understand China? Please join us, and let’s make a survey of China together. 

"
C_917306,国际经济学,未标注,MOOCCubeX,不懂国际经济学，如何看清世界。
C_917311,财经应用文写作,未标注,MOOCCubeX,"爱上写作，精彩生活！
财经应用文写作有很强的社会实践性。本课程讲授常用财经应用文的写作规律和写作方法、技巧，提高学生的写作能力，并借助读写思维的综合训练，促进学生全面发展。
诚邀你与我们同行，共度学习之旅。"
C_919146,国画基础,未标注,MOOCCubeX,本课程主要采用图片和视频来教学，每个知识点都有详细的画法步骤，富有趣味性，主要内容有“中国画概述”、“工笔花鸟画”、“写意花鸟画”、“山水画”、“中国画的构图与鉴赏”。可以学到丰富的绘画方法。尤其是没骨画法写生，可以使大家欣赏到不一样的绘画方法。
C_922850,现代电子系统设计,未标注,MOOCCubeX,本课程系统介绍基于片上系统SoC的现代电子系统，包括系统组成、设计方法、最新技术、设计样例、实验内容及实验结果展示等。帮助学生系统全面地掌握现代电子系统的设计方法，同时培养创新设计思想。
C_922860,国际航运实务（中英双语）,未标注,MOOCCubeX,欢迎大家来到《国际航运实务》课堂，让我们一起仰望星空，脚踏实地。这是一门兼顾国际视野与专业训练的课程，打开学生视野、格局。这是一门工学结合的课程，与行业、企业、政府共同研发、成长，让学生在进入职场之后，上手最快、领先升职。
C_922867,C语言程序设计,未标注,MOOCCubeX,程序设计是信息类和其他理工科一门重要的基础性课程。《C语言程序设计》面向低年级学生，内容包括：C语言概述、数据类型、运算符、表达式、结构化程序设计的三种基本结构、数组、函数、指针、结构体等。通过课程内容的讲解和编程训练，使学生具备用C语言开发应用软件的基本能力，为今后的软件开发工作奠定坚实的基础
C_922877,计算机网络,未标注,MOOCCubeX,"这是一个属于互联网的时代。想了解网络世界的神秘原理么？想一起探索网络江湖的本质技术么？《计算机网络》课程就在这里。经验丰富的教授担任主讲，认真负责的海归担任助教，工程功底深厚的工程师辅助指导！精心提炼、制作的55个知识点视频给你好看！来吧，《计算机网络》课程已经向你扑面而来，让我们携起手来，安排！
"
C_926163,消防救援技术训练,未标注,MOOCCubeX,学习新技术、创新新战法、制定新标准；打造全国消防救援队伍绳索救援“专家库”。
C_926165,性行为的生物学基础,未标注,MOOCCubeX,在我国，随着社会发展和网络的普及，大学生的性观念愈来愈开放，对涉及性和性行为的认识发生了深刻的变化。大学生正处在青春期的性敏感和活跃阶段，进行科学的系统的性教育是必不可少的。本课程《性行为的生物学基础》以生物医学为基础，从解剖学、生理学、心理学等系统、科学地阐述人类性和性行为。
C_926175,教育学,未标注,MOOCCubeX,       教育是什么？是用爱人的初心激发求知的灵魂，还是用严厉的鞭策点燃成长的动力。就让我们一同走进教育学，聆听教育的故事，领悟教育的真谛，感受教育的魅力，用一汪教育的智慧之泉，插上立德树人的理想之翼。
C_676917,英语语法和写作风格,外国语言文学,MOOCCubeX,本课程中你将学习如何遣词造句，写出深受读者喜爱的、满足大学和专业要求的文章。
C_696946,身边的营养学,未标注,MOOCCubeX,在这门课程中，我们将向您讲授蛋白质、脂类、碳水化合物、膳食纤维、维生素、矿物质和水等几大营养素的特性和生理功能。进而，我们会教会您如何理论联系实际，解决生活中的实际膳食问题。
C_676696,理解马克思,未标注,MOOCCubeX,【国家精品课】本课程重点在于激发学习者的认知兴趣，进而为他们可能的深入了解提供必要的思想史背景、文本研读方法和学术共识。课程将在一种当代视野中简要勾画马克思的思想历程，进而以《1844年经济学哲学手稿》、《共产党宣言》、《资本论》这三种著作为中心，在比较的视野中阐发理解马克思的思想世界及其当代影响。
C_677049,中国近现代史纲要,历史学,MOOCCubeX,不懂曾经苦难就不懂昨日的反抗与革命，不懂曾经动乱就不懂今日的改革与法治，本课程将为你概述1840年以来中国人民追求民族解放与复兴之路的伟大历程。
C_801420,马克思主义基本原理,未标注,MOOCCubeX,妖魔化的马克思主义？神化的马克思主义？----你了解多少？！本课程将为你还原真实的马克思主义----不仅仅是一种信仰，更重要的是一个理论体系！ 
C_697026,思想道德修养与法律基础,未标注,MOOCCubeX,《思想道德修养与法律基础》课程，带领初入大学之门的你，走入求真、求善、求美的思想旅程。
C_696911,毛泽东思想和中国特色社会主义理论体系概论,军队政治工作学,MOOCCubeX,毛泽东思想和中国特色社会主义理论体系是中国共产党治国理政的指南针、显微镜和望远镜。本课程将带你探索这些政治理论的来龙去脉、微言大义和现实影响等。本课程应与《党的十九大精神概论》配套使用。
C_707067,食物营养与食品安全,未标注,MOOCCubeX,吃出营养、吃出安全，安排好一日三餐，饮水及零食、选择适宜自己的健身模式，做一个盖章认定的高阶“吃货”！快来一起学习《食物营养与食品安全》吧！
C_697415,走进医学,未标注,MOOCCubeX,医学是融合了人类聪明才智，集科学、哲学和人文于一体的艺术学科。打开本课，您将领略到一个全新的世界，我们将带您去揭开人类疾病与健康的奥秘。
C_697007,英语语法与写作,未标注,MOOCCubeX,我也学过英语语法，但为什么我的英语写作总会犯些语法错误？好吧！让我们把语法与写作结合着学。在学好语法的同时，更学会文法——英语行文之法。
C_697106,运动与慢病防治,体育学,MOOCCubeX,随着社会的发展，我们的生活发生变化，而最引人瞩目的就是健康。一些慢性病成为影响我国人群健康的主要危害，因此慢病的防治也成了大家最关注的话题。本课程由北京师范大学运动人体科学专家带您了解高血压、颈椎病、抑郁症等常见慢病的病因及表现，带您科学运动，打造健康的生活方式。
C_680923,局部解剖学,临床医学,MOOCCubeX,【国家精品课】局部解剖学是按照人体的局部分区，研究各区域内器官与结构的位置、形态、毗邻、层次关系和临床应用的科学。
C_682168,解剖与生活,未标注,MOOCCubeX,《解剖与生活》以生活常见现象作为切入点开启对人体结构的探索，同时通过在线课程对解剖教学进行拓展和延伸。让学习者从生活实际出发，掌握人体形态结构相关的知识，懂得人体的功能，掌握常见的多种疾病形成原因、保健预防。 
C_681335,局部解剖与手术学,临床医学,MOOCCubeX,本课程把局部解剖学与临床实际手术结合起来，从课堂到实验室，从实验室到手术室，将给您呈现不一样的视觉盛宴，把基础与临床结合在一起，让学习者从零基础了解整个手术过程的完成。
C_681377,人体骨与关节解剖学,未标注,MOOCCubeX,人体解剖学是一门研究正常人体形态和构造的科学，隶属于生物科学的形态学范畴。它是一门重要的基础医学课程，为进一步学习后续的医学基础课程和临床医学课程奠定基础。
C_680877,人体科学,生物学,MOOCCubeX,人体科学从人体结构到生理，阐述机体的功能机制及其所需所能；常见病病因病理。作为通识课程，旨在让你了解自己，懂得善待自己和关爱他人，健康生活。
C_688346,运动与解剖学,未标注,MOOCCubeX,《运动解剖学》是在正常人体解剖学的基础上研究体育运动对人体形态结构、生长发育影响的学科。使学习者获得正常人体形态结构的知识，为运动技术学习、训练、运动创伤防护提供必要的解剖学知识，拓展知识面。
C_697714,口腔解剖生理学,未标注,MOOCCubeX,口腔解剖生理学是一门以研究口腔、颅、面、颈部诸部位的正常形态结构、功能活动规律及其临床应用为主要内容的学科。
C_677000,口腔探密,未标注,MOOCCubeX,你有虫牙吗？你有牙痛经历吗？刷牙出血怎么办？牙被撞了怎么办？---这些关于牙齿的知识你了解多少？本课程将有专业的有丰富临床经验的医生用通俗易懂的词语为你解惑，揭开口腔的秘密，还原一个真实而丰富的口腔世界。
C_680897,医学伦理学,临床医学,MOOCCubeX,医学伦理学，是医学与伦理学的牵手。医学伦理学，用伦理的眼透视人类所有的医学活动，它帮助我们，理解医学的人文性。
C_680733,医学伦理学,未标注,MOOCCubeX,本课程探讨医事行为的系列道德原则，包括医生与病人、同道、社会之间的关系。教育和引导学生加强医德修养，成为一名高尚医德的医务工作者。
C_682269,医学免疫学,未标注,MOOCCubeX,如果把人的机体比作是国家的话，免疫系统就是这个国家的军队，担负着“攘外安内”的重要职能，使我们拥有最宝贵的财富—健康。免疫系统有哪些免疫部队？它们是如何协同作战保卫我们机体的呢？如何增强我们机体免疫系统的作战能力，使我们永保健康呢？让一起来了解和学习人体健康的忠实卫士——神秘的免疫系统吧！
C_682248,药物分析,药学,MOOCCubeX,【2018年国家精品在线开放课程】药物分析是药学专业的核心专业课，是运用化学、物理学、生物学等方法和技术研究药物的真伪、稳定性、生物利用度、临床监测和中草药有效成分的定性和定量等内容的一门学科。
C_696890,谈医说药,未标注,MOOCCubeX,本课程是线下课程《药理学》的在线版，偏重于药物发现史及常用药物临床应用介绍，是课堂教学的有力补充。该课程属于临床医学与基础医学的桥梁学科，对医学生及药学生均有重要意义。
C_682636,中药药理学,未标注,MOOCCubeX,本课程是在中医药理论指导下，应用现代科学技术和方法，研究中药与机体之间相互作用及规律的科学。本课程将让你不再对中药的临床疗效感到神秘，能消除中医药认识的误区，为你还原真实、科学的中医药。
C_696586,神经病学,心理学,MOOCCubeX,"本课程就一些常见神经疾病做了综合概括与介绍。《神经病学》以临床问题为导向,以常见疾病为线索，循序渐进引导学生思考、理解和记忆解剖学的重要知识。"
C_682629,针灸学,未标注,MOOCCubeX,针灸学是以中医理论为指导，研究经络、腧穴及刺灸方法，探讨运用针灸防治疾病规律的一门学科。它是中医学的重要组成部分，是中医本科专业学生的必修课程，其主要内容包括经络、腧穴、刺灸法与治疗。
C_681071,医疗器械与医学创新,仪器科学与技术,MOOCCubeX,为支持公益性医疗事业的发展，完善医学知识体系，向广大在校学生和社会学习者以及医疗工作者传递心血管疾病临床科研现状为医疗从业者提供临床创新指引，开拓心血管医学临床创新的发展。
C_697284,医学寄生虫学,未标注,MOOCCubeX,寄生虫，听起来好恐怖啊！新闻里时不时跳出一些相关的事件，到底是怎么回事，又该怎么预防，《医学寄生虫学》会让你了解一切。课程的视频资料总时长达11小时，配有丰富的非视频学习资料，知识体系科学完整，既包含理论内容，又包含实验内容；既注重经典，又注重前沿；既讲解基础理论，又结合临床应用。
C_681470,经络养生与文化,未标注,MOOCCubeX,与自身对话，与自然对话，识医道、知医理，提高医学、人文素养。
C_680765,医学人文,基础医学,MOOCCubeX,《医学人文》课程主要包括：医患沟通实操、医学美学、临床决策与医患共情、如何做一名优秀的医学生、医生的职业规划与职业素养、医学法学、医学人文与传播、医学影像技术与诺贝尔奖、医学与人文九个模块，旨在医学教育中加强人文素质教育，使学生具备医学人文精神并体现在工作实践中。
C_680952,生物医学工程导论,生物医学工程,MOOCCubeX,生物医学工程将工程学方法应用到生物和医学领域，帮助人类更好的认识生物体活动并帮助病患得到更好的照料。本课程将以实例的形式介绍生物医学工程的内容。
C_676684,生物医药实验室安全知识,生物医学工程,MOOCCubeX,本课程通过大量的视频资料和实际案例，系统介绍了生物医药实验室的安全隐患、安全防范措施以及事故发生救助方法，旨在提高学生实验室安全防范意识，加强安全防范措施，有效防范安全事故发生或和减低安全事故危害。
C_697307,医学免疫学与病原生物学,未标注,MOOCCubeX,医学免疫学与病原生物学是基础课程与临床课程之间的重要桥梁。
C_735032,老年护理,未标注,MOOCCubeX,"本课程顺应了社会老龄化的需求，同时也是完整的""生命周期""教学模式中不可缺少的一部分。通过学习，学习者可以了解老年的基本概论理论；掌握老年人常见安全问题的护理、老年人常见疾病的护理及如何进行临终关怀。"
C_697265,医的奥秘,未标注,MOOCCubeX,杰出的医师科学家是怎样炼成的？医师科学家（Physician Scientists）是指具备人文社会科学、自然科学、基础医学及临床医学等相关基础理论知识，既掌握临床技能又具备科学研究能力的医学领军人才。本课程为立志成为医师科学家的同学简要介绍清华医学院的主要学科方向与基础知识，名家授课、深入浅出。
C_682210,中医养生方法学,未标注,MOOCCubeX,中医养生是中国传统文化中最具特色和实用价值的部分，在维护健康、防病治病方面起重要作用。本课程重点讲解包括精神、睡眠、饮食、药膳和运动等养生方法。
C_677018,营养与健康讲座,未标注,MOOCCubeX,你想成为一枚快乐的吃货吗？你想系统学习营养与健康知识吗？《营养与健康讲座》就是讲授食品、营养与人体健康关系的通识性课程，帮你正确认识营养问题，建立健康饮食习惯。吃的营养、吃的健康，做快乐健康中国人！
C_697051,常见病的健康管理,临床医学,MOOCCubeX,本课程是关爱家人、关心自己健康的优选课程。内容涉及常见病的识别、病因、用药指导、自我管理等，旨在与大家共同学习、分享和探讨常见病的健康管理，促进对相关知识的了解、预防和管理，使大家都能有所受益，提升健康水平。
C_682574,健康信息学,未标注,MOOCCubeX,健康是人类追求的永恒主题。健康信息学是一门研究如何利用医学和信息技术来满足用户的健康需求、解决居民生理、心理和健康能力培养等方面的健康问题。本课程属于信息管理类通识课程。课程的适用对象为中西医、卫生管理、健康管理等相关专业学生，更适合计算机科学、医学技术等专业学生和爱好者学习。
C_707068,走近马克思,未标注,MOOCCubeX,学习这门课，你将学会如何站在马克思的视角去思考，在理论推导的过程中体会马克思的良苦用心及其崇高的思想价值。
C_682659,灾害信息传播学,未标注,MOOCCubeX,本课程主要讲授灾害事件中的信息传播理论与案例，主要内容包括：神话和文学作品中的灾害、目的各异的灾害信息传播者、不可遗忘的广播媒介、受众需要什么、防不胜防的灾害谣言、灾害信息传播效果评价、社交媒体与涉灾舆情、灾害信息传播案例。
C_696989,综合英语,未标注,MOOCCubeX,        通过对精选语篇的系统分析，提高学生对英语的理解能力、赏析能力和应用能力。视频讲授内容覆盖对文章的篇章结构、词汇语法、主题内容、文化背景、修辞手法、写作技巧、人物刻画等方面的分析。
C_696987,英语演讲,未标注,MOOCCubeX,英语演讲能力是21世纪国际人才必备素质之一。你想知道英语演讲涉及哪些要素吗？你想知道如何增强演讲的可信度和感染力吗？本门课程将带你走入英语演讲的世界，剖析演讲的本质，类型和功用，从而帮助你树立自信并确定最佳演讲策略。
C_682772,主题英语,未标注,MOOCCubeX,《主题英语》陪伴你按主题学英语，用英语讲好中国文化故事。 《主题英语》支持你学习环境泛在化、学习内容中西融通、学习途径和效果知行合一。
C_696939,英语语音,未标注,MOOCCubeX,学习该课程，使学员了解英语语音的特征，能够通过练习改进自己的英语发音习惯。
C_735395,英语演讲艺术,未标注,MOOCCubeX,本课程是外语素质教育核心课程，通过分析演讲范例、讲解英语演讲的类型、结构、特点、技巧，培养学生演讲技能：用英语进行信息性演讲、说服性演讲及即兴演讲；提升国际视野、思辨、跨文化交际及有效沟通能力。
C_680818,英语辩论,未标注,MOOCCubeX,本课程是外语素质教育核心课程，介绍英语辩论各环节、讲解辩手职责，分析辩论方法、技巧，帮助学生加深对英语辩论的理解，掌握辩论基本技能，培养学生的国际视野、思辨、跨文化交际及有效沟通能力。
C_696972,学术英语,未标注,MOOCCubeX,在经济全球化的当下，你是不是想听懂各种英语学术讲座，以获取最新的前沿资讯？你是不是想通过雅思、托福考试，出国继续深造？或是想了解行业最新动态，以助你事业成功？请加入我们的课程，我们将助你一臂之力，实现梦想！
C_680785,大学英语七能拓展,外国语言文学,MOOCCubeX,《大学英语七能拓展》以培养提高学习者“知、述、论、讲、思、研、学”七大英语语言应用能力为目标，开发了符合移动互联时代特点的教学元素，激发了学生兴趣。以《大学英语教学指南》与《中国英语能力等级量表》为依据，全面重塑教学内容。以立德树人、学习树志为导向，探索了线上线下混合式教学模式。
C_697191,英语美文悦读 I –人文篇,未标注,MOOCCubeX,精选英语美文，覆盖记叙文、说明文，探讨人文问题。丰富内容，版块呈现，助力学习者轻松掌握英语的篇章结构、文化背景、词汇语法、修辞、写作技巧，深入理解文章内涵，享受阅读与思辨的乐趣。 注意：期末考试中主观题需要电脑端作答。
C_682620,英语美文悦读II —社科篇,未标注,MOOCCubeX,精选英语美文，覆盖说明文、议论文，探讨社科问题。丰富内容，版块呈现，助力学习者轻松掌握英语的篇章结构、文化背景、词汇语法、修辞、写作技巧，深入理解文章内涵，享受阅读与思辨的乐趣。
C_866756,运动与健康,体育学,MOOCCubeX,《运动与健康》全面地阐述体育运动与健康的关系、如何向体育运动要健康、不同运动项目的健康机制、运动损伤的预防与处理等基本内容。
C_707054,分子生物学——原理与技术,生物医学工程,MOOCCubeX,分子生物学是从分子水平上揭示生命本质的学科。其主要研究核酸及蛋白质在遗传信息传递过程中的功能及调控机制，是我们探索生命奥秘的重要基础和强大工具。
C_697025,中医与诊断-学做自己的医生,未标注,MOOCCubeX,古人云：为人父母者，不知医为不慈；为人儿女者，不知医为不孝。找个医生做朋友，不如自己就成为懂医的人。本课程已入选国家精品在线开放课程！欢迎学习本课程，为自身和家人的保健及就医提供依据，真正做一个慈孝之人。
C_682239,无处不在—传染病,未标注,MOOCCubeX, 在日常生活中，不管你愿意与否，我们都无时无刻在与传染病打交道。我们只有认识它、了解它，才能在帮助别人的同时保护自己。
C_682304,关爱健康·从齿开启,口腔医学,MOOCCubeX,俗话说“牙疼不是病，疼起来要人命”，口腔是消化系统的“门户”，口腔健康是全身健康的重要组成部分。世界卫生组织将口腔健康列为人体健康的十大标准之一。
C_696597,大学生心理健康,未标注,MOOCCubeX,大学生不但要心理健康，而且要发展潜能，要通过心理知识的学习和训练，培养自己理性平和、乐观开朗、健康向上的阳光心态，提高适应能力和情绪调节能力。
C_674938,自我认知与情绪管理,未标注,MOOCCubeX,
C_735328,人工智能前沿与产业趋势,未标注,MOOCCubeX,本课程是人工智能前沿与产业趋势系列课。
C_674924,智能时代下的创新创业实践,应用经济学,MOOCCubeX,在智能时代如何不被淘汰？如何站在浪尖？课程将揭示智能技术的奥秘，并给你开启智能时代的钥匙。同时通过对创新思维的解读和心理学训练来提升创新认知，开发创新潜力。本课程是献给梦想者的礼物。让我们扬帆，起航！
C_676905,职业与创业胜任力,未标注,MOOCCubeX,拥有同样背景的员工在相同的岗位上工作，但工作绩效的差距非常大，造成这一差异最直接的原因是员工的岗位胜任能力有差别。
C_697590,职场需要的18种能力,未标注,MOOCCubeX,本课程将为您展示一个多角度、全方位的今日职场。通过林老师主讲和采访职场达人的形式，让不同行业、职位、级别的职场人共同告诉您，职场精英需要具备的能力。
C_707221,食物与健康,食品科学与工程,MOOCCubeX,本门课程将提供一个科学框架，让你更好理解食物，理解一直以来食物对健康和社会的影响。
C_676676,沟通心理学,未标注,MOOCCubeX,视角独特的“主持型”心理课，正能量的“烧脑”之旅。言语犀利，案例丰富，思维训练，实用性强，主讲人裴秋宇老师凝聚19年心理医生“心战”经历、15年世界五百强员工心理内训精华，获得2016最受欢迎慕课top1、2017十大最受欢迎国家精品在线课程。
C_677068,创业新浪潮：医药健康创新创业,未标注,MOOCCubeX,新时代医药健康产业领域蕴含着无限的创新创业机遇。运用创新的思维发掘医药健康的创业机会，以新的商业模式整合医药健康领域创业资源。聆听专家建议，洞见行业真谛，对话创业青年，我们与您共同拥抱大健康时代！
C_680712,社会医学,未标注,MOOCCubeX,《社会医学》是从社会的角度研究医学和健康问题的一门交叉学科，共开设9部分内容，包括绪论、社会经济因素与健康、社会环境因素与健康、社会文化因素与健康、行为心理因素与健康、健康管理与治理、健康危险因素评价、生命质量评价、社会卫生状况。《社会医学》课程的建立符合群众对健康信息的获得的专业性，能够帮助广大群众了解正确的生活方式，为提高民众健康素养，接受科学的健康指导和正确的健康消费提供理论支持。
C_680717,临床医学导论,未标注,MOOCCubeX,介绍我国医学教育改革和卫生改革的形式和取得的成果、医学教育和卫生事业的现状，以及医学和医学教育国际化的趋势，介绍内科、外科、妇产科、儿科等基本概念和前沿进展，引导学生对医学有更加系统、完整的认识。
C_680784,体内药物与毒物分析,未标注,MOOCCubeX,体内药物与毒物分析是运用药物分析的原理和技术，对生物机体中药物及其代谢物、内源性物质以及侵入生物体内的有毒物质进行定性和定量分析，为临床药学、临床药理学、生物药剂学以及法医学提供技术支持的一门学科。
