course_id,course_name,category,teacher,description
C_584313,《资治通鉴》导读,历史学,MOOCCubeX,通过老师导读，同学们可深入这一经典文本内部，得以纵览千年历史，提升国学素养，体味人生智慧。
C_584329,微积分——极限理论与一元函数,应用经济学,MOOCCubeX,本课程是理工科的一门数学基础课，系统、全面地介绍了一元函数微积分学。课程既保持了数学的严谨和抽象的特点，也注意了数学概念的直观和形象的一面。
C_597208,数据挖掘：理论与算法,计算机科学与技术,MOOCCubeX,最有趣的理论+最有用的算法=不得不学的数据科学。
C_597225,大学计算机,未标注,MOOCCubeX,大学计算机课程将以计算思维为导向，以计算机原理、概念为基础，以新技术新方法为牵引，以创新思维能力培养为目标，和学习者一起了解计算机科学，学习计算技术，掌握思维方法。
C_597367,时尚化妆造型（2018秋）,未标注,MOOCCubeX,针对爱美人士讲解时尚生活、新娘和商业化妆造型基本原理及方法，使其能快速掌握现在时尚流行妆容造型的实际操作技能。
C_629514,《资治通鉴》导读,未标注,MOOCCubeX,通过老师导读，同学们可深入这一经典文本内部，得以纵览千年历史，提升国学素养，体味人生智慧。
C_655852,系列课-已结课无回顾时长,未标注,MOOCCubeX,目前数据科学和人工智能的人才缺口空前之大，人们对AI相关知识的学习需求也大大增加。 本课程主要由8次讲座以及1个转化挑战任务组成，讲座每隔一周举办一次
C_655850,系列课-开课未开始,未标注,MOOCCubeX,目前数据科学和人工智能的人才缺口空前之大，人们对AI相关知识的学习需求也大大增加。 本课程主要由8次讲座以及1个转化挑战任务组成，讲座每隔一周举办一次
C_654554,系列课-开课中,未标注,MOOCCubeX,目前数据科学和人工智能的人才缺口空前之大，人们对AI相关知识的学习需求也大大增加。 本课程主要由8次讲座以及1个转化挑战任务组成，讲座每隔一周举办一次
C_654506,系列课-开课已结束有回顾时长,未标注,MOOCCubeX,目前数据科学和人工智能的人才缺口空前之大，人们对AI相关知识的学习需求也大大增加。 本课程主要由8次讲座以及1个转化挑战任务组成，讲座每隔一周举办一次
C_629558,医学免疫学与病原生物学,未标注,MOOCCubeX,目前数据科学和人工智能的人才缺口空前之大，人们对AI相关知识的学习需求也大大增加。 本课程主要由8次讲座以及1个转化挑战任务组成，讲座每隔一周举办一次
C_629503,信息素养——学术研究的必修课（2019春）,情报与档案管理,MOOCCubeX,目前数据科学和人工智能的人才缺口空前之大，人们对AI相关知识的学习需求也大大增加。 本课程主要由8次讲座以及1个转化挑战任务组成，讲座每隔一周举办一次
C_597314,大学国文——北宋至现代文学赏析,中国语言文学,MOOCCubeX,目前数据科学和人工智能的人才缺口空前之大，人们对AI相关知识的学习需求也大大增加。 本课程主要由8次讲座以及1个转化挑战任务组成，讲座每隔一周举办一次
C_674903,不朽的艺术：走进大师与经典,艺术学,MOOCCubeX,【国家精品课】以历史为经线，中外比较为纬线，以文化解读为主导，引导修课学生欣赏和理解中西艺术史发展中最伟大的大艺术家及其不朽艺术杰作的美学特征和文化精神意蕴。
C_674910,图案审美与创作,未标注,MOOCCubeX,【国家精品课】本课程提供图案感受美、提炼美、表现美的过程体验。学习图案可以了解历史，感受时代的脉搏。您将获得艺术创作思维的拓展与适合自己的图案创作方法。
C_674912,音乐与健康,未标注,MOOCCubeX,本课程精心设计了音乐与健康、治疗、养生、音乐处方单等八个专题的内容，适合喜爱音乐和关注身心健康的人群。
C_674914,管理会计学,未标注,MOOCCubeX,本课程顺应新经济发展趋势，主要讲述了管理会计基础理论和实际运用方法，旨在为学员搭建起管理会计的基本框架体系。
C_674920,逻辑学概论,哲学,MOOCCubeX,“逻辑”是什么？大家都很熟悉却又似乎难以说清。本课程将告诉你：作为一门学科，逻辑学研究的是什么，以及它的基本思路、原则和方法。
C_674923,行政职业能力提升,未标注,MOOCCubeX,《行政职业能力提升》课程是为广大学生和在职工作人员进行行政职业能力培养与训练的课程。通过学习，学员可以提升未来行政职场上的竞争力，打造行政精神、提升行政气质、强化沟通能力，训练行政口才，提高职业竞争力。
C_674937,中华传统文化与人生修养,未标注,MOOCCubeX,本课程将带领你走进中华传统文化的世界，从先秦开始，走过魏晋南北朝，领略唐宋元明清的精彩文化，学习儒佛道的精神，走进古人的精神世界。
C_674950,经济地理与企业兴衰,地理学,MOOCCubeX,经济地理学是一门关于人为生存而抗争的地理学。它是现代地理学的重要分支，主要探讨企业的经济活动与地理和环境之间的复杂动态关系。
C_674959,《道德经》的智慧启示,未标注,MOOCCubeX,本课程运用《易经》的原理，从历史与现实、理论和实际来阐释《道德经》所蕴含的101种人生智慧。学习本课，得道多助，失道寡助，惟道是从，道者无敌。
C_674962,《红楼梦》的空间艺术,中国语言文学,MOOCCubeX,翻转红楼看世界，一夜知晓古今中外视觉文化的建筑艺术与嗅觉文化的香气空间，培养跨界比较的创新思维。不学你就亏大了哟！
C_674968,巴蜀文化,中国语言文学,MOOCCubeX,巴蜀文化是中华文明绽放于西南大地的灿烂之花。本课程将从考古、历史、文学、宗教、哲学、艺术、地理、风俗、人物等方面引领你走入一个五彩斑斓的巴蜀文化世界。
C_674971,宝玉石鉴赏,未标注,MOOCCubeX,【国家精品课】宝玉石，既是自然美的精华，也是财富身份的象征。《宝玉石鉴赏》让你了解宝石的自然属性和历史文化，带你进入宝石的奇妙世界。
C_676642,创办新企业,工商管理,MOOCCubeX,"《创办新企业》课程由清华科技园和清华大学经济管理学院联合开设，是国家首批精品在线开放课程；获2017年全国高等学校创新创业教育“精彩一课”（视频公开课）。
"
C_676648,创业101：你的客户是谁？,未标注,MOOCCubeX,在你的创业旅途中，你会发现：创业中最重要的资源是客户。赶快加入MIT《创业101》课程，成为这个社区的一员吧！
C_676649,儒家修身之道,中国语言文学,MOOCCubeX,儒家使中国人理性早启，塑造了我们的情感方式，医治我们的心灵伤痛。儒学是真正的知识，就像三三得九，修身之道是基础。
C_676651,创业102：你能为客户做什么？,未标注,MOOCCubeX,你可以为你的客户做些什么？
C_676656,创业启程,未标注,MOOCCubeX,企业家讲授，教授点评，案例与理论结合，帮你打开通往创业的大门，让你掌握并学会运用机会识别等创业理论，感受冒险进取、坚持不懈的创业精神的魅力。
C_676658,党的十九大精神概论,军队政治工作学,MOOCCubeX,该课程是冯务中老师2015年开设的国家精品在线开放课程《毛泽东思想和中国特色社会主义理论体系概论》的配套课程，通过纵横比较、史论结合、宏微并重，系统解读十九大精神。
C_676659,审美的历程,哲学,MOOCCubeX,"       本课程是首次以艺术为载体，以历史唯物主义为指南，全面揭示人类文明进化是一个由新的社会形态对旧的社会形态的不断扬弃过程，这是《审美的历程》中极其重要的历史表述。
        在对人类不同社会形态审美观的形成、发展和演变规律进行唯物史观的解读和批判中，展开了一幅真善美与假丑恶那惊心动魄的历史画卷，这是《审美的历程》中最精彩的思想内涵。
       相信，《审美的历程》的学习过程，必是历史新思维的形成过程。"
C_676661,创意 Creativity,未标注,MOOCCubeX,我們團隊的心理學家，文學家和藝術家將引導你走一段極具挑戰性但充滿趣味性的學習旅程。本課程會令你耳目一新，將平凡的你轉化為非凡的你。
C_676662,生活、艺术与时尚：中国服饰七千年,艺术学,MOOCCubeX,【国家精品课】本课程为国家精品课入选课程“中国服装史”，详细诠释中国服饰艺术特征、发展脉络、时尚变迁和文化内涵，图解中国服饰式样结构与工艺特点，举例中国风时装设计，分析中国元素时装创新设计途径。
C_676664,大国航母与舰载机,未标注,MOOCCubeX,本课程将带您走进大国航母与舰载机的世界，为您揭开世界各国现役航母神秘的面纱！
C_676681,婚恋·职场·人格,未标注,MOOCCubeX,“世界上最难的道路，就是通往自己的道路”。本课程把人格、婚恋与职场三者结合，以人格为基石，阐述不同人格类型的婚恋和职场特点。本门课程是武汉理工大学著名的“网红”课程，因其学术性、实用性和趣味性兼备，深受学生的喜爱和追捧。
C_676682,文科物理学——生活中的物理,未标注,MOOCCubeX,你不会领会到周围世界奥秘所在，除非你懂得自然界的规律！本课程将带你一起探索丰富多彩的物理世界，展示自然界中万事万物如何巧妙、完美地联系在一起。
C_676683,积极心理学（下）自强不息篇,心理学,MOOCCubeX,本课程是积极心理学基础入门的概述性课程，旨在让学生科学系统地了解积极心理学的研究范畴，包括幸福、美德、亲社会心理与行为、福流、价值观与人生意义、积极心理学应用等内容。
C_676685,经典导读与欣赏,未标注,MOOCCubeX,该课程以“审美、鉴赏、交流”为核心，集知识性与趣味性、思想性与艺术性、实用性与审美性于一体。
C_676686,经典与思考——人文清华大师面对面,教育学,MOOCCubeX,人文清华慕课，汇集清华大学最优秀的人文社科学者。每个单元认识一位大家、了解一门学科，精读一本著作，深入思考一个问题。
C_676687,决胜移动互联网：创业者的商业模式课,工商管理,MOOCCubeX,如何理解移动互联网时代的商业模式？如何运用移动互联网开展颠覆式创新？如何把握未来机遇？本课程帮助你系统学习移动互联网时代的创新及成长之道。
C_676692,科举与中国文化,未标注,MOOCCubeX,【国家精品课】科举制与科举文化是中国文化的重要组成部分，其对中国传统文化的特质、中国传统知识分子的政治品格、普通大众的价值观念等都产生了重要的影响。本课程为国家精品在线开放课程。
C_676697,孙子兵法,战术学,MOOCCubeX,本课程按五大模块，即兵圣孙武、价值论、战争观、将帅观、谋略思想，从理论与实践两个层面分七讲讲授《孙子兵法》的军事战理，及蕴含其中的企业智慧、人生哲学等。
C_676705,民法与生活,法学,MOOCCubeX,本课程是一门面向非法学专业学生及社会人士修读的法律类课程。民法源于生活，人的一生无时无刻不与民法息息相关。课程通过讲解大量经典案例，介绍民法的基本概念、基本制度和基本理论，使受众者增强权利意识，学会从民法的角度观察生活，并运用民法指导自己的生活，维护自己的合法权益。
C_676820,外国工艺美术史,艺术学,MOOCCubeX,【国家精品课】本课程为清华大学人文素质核心课程。一部工艺美术史，是人类文明不断发展，演变和进步历程的形象记录。
C_676885,幼儿音乐教育与活动指导,未标注,MOOCCubeX,本课程针对学前教学专业学生或打算未来从事幼儿教育工作者开设，指导学生获得计划、设计、实施、评价幼儿音乐教育与活动的知识与能力，为实践做准备，促进学前教育专业学生（以及在职幼儿教师）的专业化成长。
C_676887,技术创新管理,未标注,MOOCCubeX,谷歌、华为、3M、科大讯飞、可口可乐、雀巢、西门子……都是如何走向成功的？清华大学经济管理学院陈劲教授带你解读技术创新背后的管理思维！
C_676890,环境污染事件与应急响应,环境科学与工程,MOOCCubeX,"课程采用案例教学和讨论式教学。首先讲述环境应急管理概论。然后对国内外重大环境突发事件，如松花江水污染事件、太湖蓝藻爆发导致水污染事件、莱茵河水污染事件、伦敦烟雾事件、北京雾霾事件及天津大爆炸事件等进行研讨。对重大环境污染事件产生的背景、原因、生态恢复措施、责任追究、应急处置措施、生态环境影响等多种方式的讨论。课程采用启发式教学，采用教师先介绍事件背景，提出不同的问题，吸引学生思考。然后教师进行归纳解答的方式进行教学。
       对环境应急管理体系、环境应急管理的预警预防和准备、环境应急响应进行探讨。对我国环境应急管理的内涵、特点、基本原则、应急体系等进行总结，使学员对我国的环境应急管理体制有更深刻的认识。"
C_676897,现代礼仪与修养,未标注,MOOCCubeX,《现代礼仪与修养》  课程共有八个章节，礼仪文化--感受文化底蕴、个人形象礼仪--打造360度无死角完美形象、日常交往礼仪--礼仪细节决定成败、职场礼仪--让你获得职场好人缘、商务礼仪--赢在礼仪、赢在职场、交际沟通礼仪--优秀的人从来不会输在表达上、日常茶礼仪--以茶会友，传承中国茶文化、涉外礼仪--具备在国际交往中获得尊重的能力
C_676898,物理与人类未来,社会学,MOOCCubeX,我们生活在科学和技术的年代，将领略科学在财富、医学、人工智能、纳米技术、新能源及航天等领域带来的革命性发展。谁将是未来的赢家和输家？本课通过具体的物理图像而不是数学方法，呈现古典与现代物理学的广阔视野。This course presents classical and modern physics
C_676900,诗情画意的光学,光学工程,MOOCCubeX,本课程为大学物理中光学的全部内容，包括几何光学、波动光学和光量子理论三大部分。对中学没有学过光学模块的也可在这里完成从入门到提高的全过程。另外本课程力求摆脱以应试来学习物理课程的不良学习习惯，在课程中贯穿科学史并尝试用人文色彩讲述光学课程。
C_676902,西方思想经典与现代社会,社会学,MOOCCubeX,【国家精品课】在21世纪的今天，是否每个人每个国家都已进入现代社会？现代社会与古代社会分别建立在哪些原则上？权利原则的确立是人类迈向现代社会的一个标志。
C_676907,社会创新与创业,未标注,MOOCCubeX,通过对社会创新领域专业与通识内容的广泛学习、探索与实践，全面多角度地了解和掌握社会创新的基本理论与方法。
C_676915,现代礼仪,艺术学,MOOCCubeX,现代社会离不开人际交往，人际交往离不开现代礼仪。课程融理论性、指导性、实践性、艺术性和趣味性为一体，助你成为有修养、有品位、有风度、有气质，懂得爱己爱人的现代人。
C_676918,技术创新简史,科学技术史,MOOCCubeX,本课程讲述18世纪以来工业革命的技术创新规律和重要领域的技术变革，总结前三次工业革命的历史经验，着重分析第四次工业革命对经济社会产生的影响。
C_676934,设计的力量,艺术学,MOOCCubeX,本课程主要以人类设计历史，尤其是过去250年中发生的重大历史事件为线索，梳理设计在国家发展过程中产生的重大影响。
C_676950,比较宪法,法学,MOOCCubeX,宪法决定我们的生活方式。因为宪法规范国家权力，配置社会资源。如何通过宪制安排促进权力与资源的合理分配？各国宪法制度各异而又有异曲同工之处。
C_676953,汇编语言程序设计,计算机科学与技术,MOOCCubeX,不仅仅是一门编程语言，汇编语言更是计算机系统软硬件的分界与桥梁，是理解整个计算机系统的有效起点，为学习后续的计算机系统课程打下基础。
C_676962,自然保护与生态安全：拯救地球家园,环境科学与工程,MOOCCubeX,本课程采用最新数据和案例，讲述自然保护的基础知识、现状和热点问题。探讨生态危机对人类的威胁，寻求拯救地球家园的方法。
C_676967,华文教育技术与实践,外国语言文学,MOOCCubeX,教学数字化，让华文学习更有趣、更有效！（Digital teaching makes Chinese learning more interesting and effective. ）
C_676969,中国房地产发展之路,理论经济学,MOOCCubeX,课程以透析房地产业的各级产业链和房地产的各物业类型为双向维度展开，剖析房地产业在国民经济中的地位以及房地产业和房地产市场发展所面临的挑战。
C_676978,原来姹紫嫣红开遍——昆曲艺术欣赏,艺术学,MOOCCubeX,课程将介绍昆曲的基本知识，包括中国戏曲概况、昆曲的来龙去脉、昆曲的剧目、昆曲的艺术特色、昆曲的音乐和语言、昆曲的现状和展望等。
C_676996,20世纪西方音乐,未标注,MOOCCubeX,基于20世纪西方音乐，什么是音乐、什么是20世纪西方音乐及什么是有效聆听为全课核心线索，引导学生发展美感能力，促进其全面聆听能力的培养。
C_677004,古诗今读,未标注,MOOCCubeX,该课程采用师生对话的形式，以古诗为主题，以问题为导向，引导大家对古诗的文本细读并探究其内在逻辑，以提高对古诗的兴趣和鉴赏体悟能力。
C_677009,大学美育,未标注,MOOCCubeX,美，不仅是抽象的理论，也是感性的欣赏；美，不仅隶属于艺术的王国，也包含了对自然和人生的体验和感悟。让我们怀着这样的信念，一起踏上曼妙的寻美之旅。
C_677010,Java程序设计,计算机科学与技术,MOOCCubeX,【国家精品课】课程介绍Java的基础语法和面向对象的程序设计方法和GUI程序开发方法。
C_677014,中国传统文化,未标注,MOOCCubeX,课程以中国传统文化的基本精神为主线，分模块，从多层次、多角度展示了儒道释文化，兵法、文学、音乐、绘画、书法等中国传统文化的主要内容和特色，最后归结到世界格局中的中国文化和新世纪中国文化的展望，形成了浓厚的人文氛围。
C_677019,英语畅谈中国,未标注,MOOCCubeX,课程以英语为授课语言媒体，展示中国传统文化的特色内容和亮点精华，使学习者在了解中国文化的同时有效提高英语能力，成为走向世界的中国文化传播者。
C_677020,中国古代礼义文明——礼学经典,历史学,MOOCCubeX,中国是传承千年的礼仪之邦，中国文化的核心是礼。本课程将枚举一些文献材料，再辅之以一些分析举例，深入浅出地讲授中国古代礼仪文明的基本框架。
C_677028,中国古代礼义文明——礼制,历史学,MOOCCubeX,讲授中国古代礼义文明的基本框架，使学生在了解中华传统礼义的过程中培养人文情怀，塑造优秀品格，关心社会民生，进而在日常生活中践行礼与义。
C_677031,传播学原理,新闻传播学,MOOCCubeX,【国家精品课】传播无处不在，传播无时不有。50年前，麦克卢汉发出惊世之语：媒体是人体的延伸。如今，我们人人都是媒体，时时都在传播。
C_677038,e时代的大佬师——慕课教师的修炼心法,教育学,MOOCCubeX,慕课正在逐渐改变着教与学的模式，将最新的教育理念和技术手段服务于教育的改革之中。本课将深入探讨慕课的制作与运营，武装每一位e时代的老师。
C_677043,慕课问道,体育学,MOOCCubeX,问慕课之道，解慕课之惑。学习了本课程，你将能够对慕课的形态、发展趋势、与高等教育的关系等有具体的认识和深入的思考。
C_677045,e时代的教与学——慕课引发的混合式教学,教育学,MOOCCubeX,混合式教学，在线学习与常规师生面授教学相结合，将带来教学模式的新变革。本课由清华大学的第一批混合式教学实践教师现身说法，为您分享他们的经验。
C_677052,C程序设计案例教程（基础）,未标注,MOOCCubeX,C语言曾开发出UNIX操作系统等经典系统。随着物联网、人工智能、大数据、云计算等新技术不断发展，也广泛用于开发各种应用程序，且易于使用，还具有硬件底层执行能力，因此能够持久丰富与发展，在TIOBE世界排行榜中始终位于前列。
C_677055,实用绳结技术,战术学,MOOCCubeX,你系鞋带儿的方法对吗？你知道发生火灾时如何从高处使用绳索逃生吗？想学习用绳结编个漂亮的手链或者小蜻蜓吗？想学习更多的绳结知识吗？小绳结也有大学问！大连海事大学《实用绳结技术》是一门具有航海特色、通识和专业兼具的有趣的课程，大家来看看吧！
C_677061,中国少数民族神话赏析,中国语言文学,MOOCCubeX,在中华民族文明史上，55个少数民族神话是一笔珍贵的文化遗产。同学们在富有启迪的少数民族神话赏析中，体悟中华民族神话多元一体、美美与共的民族精神，享受少数民族神话特有的神韵与内涵。
C_677077,中国文学名著选读,未标注,MOOCCubeX,本课程选取中国文学有时代及文体代表性的名家名作，以朝代为时间线索，以作品为精研对象，以文体为扩展知识点，引导大家“漫步文学长廊，察观文体衍变，传承文化星火”，深入系统赏析中国文学名著。​​
C_677076,美国政治概论,政治学,MOOCCubeX,一个年轻的国家，拥有历史悠久的宪法；追求民主，却提防民粹；热爱自由，却同样热爱法律——美国，一个谜一样的国家，本课程带你理解它的政治机制。
C_677087,中国哲学经典著作导读,中国语言文学,MOOCCubeX,这是一个全球化、信息化、快餐化的时代；全球化拷问着人们的文化根基，信息化拷问着人们的价值信仰，快餐化拷问着人们的经典阅读。 民族的就是世界的。为继承弘扬中华文化传统，我们特意打造这门课，希冀提供一个阅读哲学经典、传承中国文化、铸造民族精神的平台，让中国文化走向世界、走向未来。
C_677089,结构力学,力学,MOOCCubeX,习武要锻炼筋骨，写文章要理清脉络。结构力学就是教您分析建筑的“筋骨”——结构怎样受力、传力和变形，理清力学思维脉络的秘籍。
C_677095,庄子哲学导读,哲学,MOOCCubeX,闻一多说：“中国人的文化上永远留着庄子的烙印。”每一个中囯人，都应该读一读《庄子》。
C_677093,人像摄影,未标注,MOOCCubeX,本课程重点讲授：人像摄影器材与使用、人像摄影的用光造型、人像摄影的构图技巧、人像摄影的摆姿技巧、人像摄影的色彩和影调的应用，对学习创作人像摄影作品有非常好的借鉴作用。
C_677102,走进性科学,教育学,MOOCCubeX,"性很污吗？性只可意会不可言传吗？性只是两腿之间的事吗？你是否想窥视性即又不敢正视性呢？课程将以全新的理念让你了解“全面的性”。掌握性卫生保健知识、增强自我保护意识和能力、理智看待社会性现象、正确处理两性关系、增强作决定能力和背后的责任。
让我们一起走进性科学，去揭开性的神秘面纱！助力健康中国行动！
"
C_677110,科学计算与MATLAB语言,未标注,MOOCCubeX,当前，科学计算已经成为科学研究、技术创新的重要方法与手段，MATLAB为众多领域的科学计算问题提供了全面的解决方案，被誉为巨人肩膀上的工具。通过本课程的学习，我们将能站在巨人的肩膀上领略各种计算之美。
C_677118,走近中华优秀传统文化,社会学,MOOCCubeX,本课程以经典文本为据，以古今案例为辅，深入浅出，使学习者以真实不妄的态度“走近”中华优秀传统文化，了解中华传统文化基本理念，正确认识和弘扬传统文化。
C_677130,歌唱启蒙与表演——教你成为歌唱达人,未标注,MOOCCubeX,我们天天在说话、经常会因为愉悦的心情而尽情高歌，可是你知道如何科学用嗓吗？你知道如何唱出美妙的歌声吗？学习这门课程，相信你会慢慢理解“人声合一”的科学用嗓方法。
C_677129,媒体大数据挖掘与案例实战,未标注,MOOCCubeX,什么是大数据（Big Data）？它将如何改变我们的社会生活？《媒体大数据挖掘与案例实战》课程内容涵盖“大数据”的主要几个方面，包含数据获取、文本分析、网络分析、数据挖掘和大数据可视化等方面，旨在帮助学生认识大数据，同时学习方法，掌握相关技术。
